rule_number,title,category,url,content_length,word_count
8.487,"Opposition and amicus curiae briefs  (a) Preliminary opposition  (1) Within 10 days after the petition is filed, the respondent or any real party in interest, separately or jointly, may serve and file a preliminary opposition. (2) A preliminary opposition must contain a memorandum and a statement of any material fact not included in the petition. (3) Within 10 days after a preliminary opposition is filed, the petitioner may serve and file a reply. (4) Without requesting preliminary opposition or waiting for a reply, the court may grant or deny a request for temporary stay, deny the petition, issue an alternative writ or order to show cause, or notify the parties that it is considering issuing a peremptory writ in the first instance.  (b) Return or opposition; reply  (1) If the court issues an alternative writ or order to show cause, the respondent or any real party in interest, separately or jointly, may serve and file a return by demurrer, verified answer, or both. If the court notifies the parties that it is considering issuing a peremptory writ in the first instance, the respondent or any real party in interest may serve and file an opposition. (2) Unless the court orders otherwise, the return or opposition must be served and filed within 30 days after the court issues the alternative writ or order to show cause or notifies the parties that it is considering issuing a peremptory writ in the first instance. (3) Unless the court orders otherwise, the petitioner may serve and file a reply within 15 days after the return or opposition is filed. (4) If the return is by demurrer alone and the demurrer is not sustained, the court may issue the peremptory writ without granting leave to answer.  (c) Supporting documents  Any supporting documents accompanying a preliminary opposition, return or opposition, or reply must comply with rule 8.486(c)-(d).  (Subd (c) adopted effective January 1, 2014.)  (d) Attorney General's amicus curiae brief  (1) If the court issues an alternative writ or order to show cause, the Attorney General may file an amicus curiae brief without the permission of the Chief Justice or presiding justice, unless the brief is submitted on behalf of another state officer or agency. (2) The Attorney General must serve and file the brief within 14 days after the return is filed or, if no return is filed, within 14 days after the date it was due. For good cause, the Chief Justice or presiding justice may allow later filing. (3) The brief must provide the information required by rule 8.200(c)(2) and comply with rule 8.200(c)(5). (4) Any party may serve and file an answer within 14 days after the brief is filed.  (Subd (d) amended effective January 1, 2017; adopted as subd (c); previously relettered as subd (d) effective January 1, 2014.)  (e) Other amicus curiae briefs  (1) This subdivision governs amicus curiae briefs when the court issues an alternative writ or order to show cause. (2) Any person or entity may serve and file an application for permission of the Chief Justice or presiding justice to file an amicus curiae brief.  CALIFORNIA RULES OF COURT   2025",,,7393,
8.491,"Responsive pleading under Code of Civil Procedure section 418.10  If the Court of Appeal denies a petition for writ of mandate brought under Code of Civil Procedure section 418.10(c) and the Supreme Court denies review of the Court of Appeal's decision, the time to file a responsive pleading in the trial court is extended until 10 days after the Supreme Court files its order denying review.  Rule 8.491 adopted effective January 1, 2009.  CALIFORNIA RULES OF COURT   2025",,,481,
8.611,"Juror-identifying information  (a) Application  A clerk's transcript, a reporter's transcript, or any other document in the record that contains juror-identifying information must comply with this rule.  (b) Juror names, addresses, and telephone numbers  (1) The name of each trial juror or alternate sworn to hear the case must be replaced with an identifying number wherever it appears in any document. The superior court clerk must prepare and keep under seal in the case file a table correlating the jurors' names with their identifying numbers. The clerk and the reporter must use the table in preparing all transcripts or other documents. (2) The addresses and telephone numbers of trial jurors and alternates sworn to hear the case must be deleted from all documents.  (c) Potential jurors  Information identifying potential jurors called but not sworn as trial jurors or alternates must not be sealed unless otherwise ordered under Code of Civil Procedure section 237(a)(1).  Rule 8.611 adopted effective April 25, 2019.  Advisory Committee Comment  Rule 8.611 implements Code of Civil Procedure section 237.  CALIFORNIA RULES OF COURT   2025",,,1150,
8.871,"Juror-identifying information  (a) Applicability  In a criminal case, a clerk's transcript, a reporter's transcript, or any other document in the record that contains juror- identifying information must comply with this rule.  (b) Juror names, addresses, and telephone numbers  (1) The name of each trial juror or alternate sworn to hear the case must be replaced with an identifying number wherever it appears in any document. The trial court clerk must prepare and keep under seal in the case file a table correlating the jurors' names with their identifying numbers. The clerk and the reporter must use the table in preparing all transcripts or other documents. (2) The addresses and telephone numbers of trial jurors and alternates sworn to hear the case must be deleted from all documents.  (c) Potential jurors  Information identifying potential jurors called but not sworn as trial jurors or alternates must not be sealed unless otherwise ordered under Code of Civil Procedure section 237(a)(1).  Rule 8.871 adopted effective January 1, 2009.  Advisory Committee Comment  This rule implements Code of Civil Procedure section 237.  CALIFORNIA RULES OF COURT   2025",,,1170,
2.141,"Local court forms  Local court forms are governed by the rules in this chapter and rules 10.613 and 10.614.  Rule 2.141 adopted effective January 1, 2007.  CALIFORNIA RULES OF COURT   2025",,,195,
2.303,"Filing through fax filing agency  (a) Transmission of document for filing  A party may transmit a document by fax to a fax filing agency for filing with any trial court. The agency acts as the agent of the filing party and not as an agent of the court.  (b) Duties of fax filing agency  The fax filing agency that receives a document for filing must: (1) Prepare the document so that it complies with the rules in division 2, chapter 1 of this title and any other requirements for filing with the court; (2) Physically transport the document to the court; and (3) File the document with the court, paying any applicable filing fee.  (Subd (b) amended effective January 1, 2007.)  (c) Requirement of advance arrangements  A fax filing agency is not required to accept papers for filing from any party unless appropriate arrangements for payment of filing fees and service charges have been made in advance of any transmission to the agency. If an agency receives a document from a party with whom it does not have prior arrangements, the agency may discard the document without notice to the sender.  (Subd (c) amended effective January 1, 2007.)  (d) Confidentiality  A fax filing agency must keep all documents transmitted to it confidential except as provided in the rules in this chapter.  (Subd (d) amended effective January 1, 2007.)  (e) Certification  A fax filing agency, by filing a document with the court, certifies that it has complied with the rules in this chapter and that the document filed is the full and unaltered fax-produced document received by it. The agency is not required to give any additional certification.  (Subd (e) amended effective January 1, 2007.)  (f) Notation of fax filing  Each document filed by a fax filing agency must contain the phrase ""By fax"" immediately below the title of the document.  (Subd (f) amended effective January 1, 2007.) Rule 2.303 amended and renumbered effective January 1, 2007; adopted as rule 2005 effective March 1, 1992.  CALIFORNIA RULES OF COURT   2025",,,2012,
2.304,"Direct filing  (a) Courts in which applicable  A party may file by fax directly to any court that, by local rule, has provided for direct fax filing. The local rule must state that direct fax filing may be made under the rules in this chapter and must provide the fax telephone number for filings and specific telephone numbers for any departments to which fax filings should be made directly. The court must also accept agency filings under rule 2.303.  (Subd (a) amended effective January 1, 2007.)  (b) Mandatory cover sheet  A party filing a document directly by fax must use the   Facsimile Transmission Cover Sheet (Fax Filing)   (form MC-005). The cover sheet must be the first page transmitted, to be followed by any special handling instructions needed to ensure that the document will comply with local rules. Neither the cover sheet nor the special handling instructions are to be filed in the case. The court must ensure that any credit card information on the cover sheet is not publicly disclosed. The court is not required to keep a copy of the cover sheet.  (Subd (b) amended effective January 1, 2007.)  (c) Notation of fax filing  Each document transmitted for direct filing with the court must contain the phrase ""By fax"" immediately below the title of the document.  (Subd (c) amended effective January 1, 2007.)  (d) Presumption of filing  A party filing by fax must cause the transmitting fax machine to print a transmission record of each filing by fax. If the document transmitted to the court by fax machine is not filed with the court because of (1) an error in the transmission of the document to the court that was unknown to the sending party or (2) a failure to process the document after it has been received by the court, the sending party may move the court for an order filing the document nunc pro tunc. The motion must be accompanied by the transmission record and a proof of transmission in the following form: ""On (date) ___________ at (time) __________, I transmitted to the (court name) _______________ the following documents (name) ________________ by fax machine, under California Rules of Court, rule 2.304. The court's fax telephone number that I used was (fax telephone number) ___________. The fax machine I used complied with rule 2.301 and no error was reported by the machine. Under rule 2.304, I caused the machine to print a transmission record of the transmission, a copy of which is attached to this declaration. ""I declare under penalty of perjury under the laws of the State of California that the foregoing is true and correct.""  (Subd (d) amended effective July 1, 2013; previously amended effective January 1, 2007.)  (e) Payment of fees by credit card  (1)   Credit or debit card payments  The court may permit credit cards, debit cards, electronic funds transfers, or debit accounts to be used to pay filing fees for fax filings made directly with the court, as provided in Government Code section 6159, rule 10.820, and other applicable laws. The cover sheet for these filings must include (1) the credit or debit card account number to which the fees may be charged, (2) the signature of the cardholder authorizing the charging of the fees, and (3) the expiration date of the credit or debit card. (2)   Rejection of charge  CALIFORNIA RULES OF COURT   2025",,,4527,
2.306,"Service of papers by fax transmission  (a) Service by fax  (1)   Agreement of parties required  Service by fax transmission is permitted only if the parties agree and a written confirmation of that agreement is made. (2)   Service on last-given fax number  Any notice or other document to be served must be transmitted to a fax machine maintained by the person on whom it is served at the fax machine telephone number as last given by that person on any document that the party has filed in the case and served on the party making service.  (Subd (a) amended and lettered effective January 1, 2007; adopted as part of subd (b) effective March 1, 1992.)  (b) Service lists  (1)   Duties of first-named plaintiff or petitioner  In a case in which the parties have agreed to service by fax, the plaintiff or petitioner named first in the complaint or petition, in addition to its responsibilities under rule 3.254, must: (A) Maintain a current list of the parties that includes their fax numbers for service of notice on each party; and (B) Furnish a copy of the list on request to any party or the court. (2)   Duties of each party  In a case in which the parties have agreed to service by fax, each party, in addition to its responsibilities under rule 3.254, must: (A) Furnish the first-named plaintiff or petitioner with the party's current fax number for service of notice when it first appears in the action; and (B) If the party serves an order, notice, or pleading on a party that has not yet appeared in the action, serve a copy of the service list under (1) at the same time that the order, notice, or pleading is served.  (Subd (b) adopted effective January 1, 2008.)  (c) Transmission of papers by court  A court may serve any notice by fax in the same manner that parties may serve papers by fax.  (Subd (c) relettered effective January 1, 2008; adopted as subd (b) effective January 1, 2007.)  (d) Notice period extended  Except as provided in (e), any prescribed period of notice and any right or duty to do any act or make any response within any prescribed period or on a date certain after the service of a document served by fax transmission is extended by two court days.  (Subd (d) amended effective July 1, 2008; adopted as part of subd (b) effective March 1, 1992; previously amended and lettered as subd (c) effective January 1, 2007; previously relettered as subd (d) effective January 1, 2008.)  (e) Extension inapplicable to certain motions  The extension provided in (d) does not apply to extend the time for the filing of: (1) A notice of intent to move for new trial; (2) A notice of intent to move to vacate a judgment under Code of Civil Procedure section 663; or  CALIFORNIA RULES OF COURT   2025",,,5610,
2.570,"Filing False Claims Act records under seal  (a) Application  Rules 2.570-2.573 apply to records initially filed under seal pursuant to the False Claims Act, Government Code section 12650 et seq. As to these records, rules 2.550-2.551 on sealed records do not apply.  (Subd (a) amended effective January 1, 2007.)  (b) Definitions  As used in this chapter, unless the context or subject matter otherwise requires: (1) ""Attorney General"" means the Attorney General of the State of California. (2) ""Prosecuting authority"" means the county counsel, city attorney, or other local government official charged with investigating, filing, and conducting civil legal proceedings on behalf of or in the name of a particular political subdivision. (3) "" Qui tam   plaintiff"" means a person who files a complaint under the False Claims Act. (4) The definitions in Government Code section 12650 apply to the rules in this chapter.  (Subd (b) amended effective January 1, 2007.)  (c) Confidentiality of records filed under the False Claims Act  Records of actions filed by a   qui tam   plaintiff must initially be filed as confidential and under seal as required by Government Code section 12652(c). Until the seal is lifted, the records in the action must remain under seal, except to the extent otherwise provided in this rule.  (d) Persons permitted access to sealed records in a False Claims Act case  (1)   Public access prohibited  As long as the records in a False Claims Act case are under seal, public access to the records in the case is prohibited. The prohibition on public access applies not only to filed documents but also to electronic records that would disclose information about the case, including the identity of any plaintiff or defendant. (2)   Information on register of actions  As long as the records in a False Claims Act case are under seal, only the information concerning filed records contained on the confidential cover sheet prescribed under rule 2.571(c) may be entered into the register of actions that is accessible to the public. (3)   Parties permitted access to the sealed court file  As long as the records in a False Claims Act case are under seal, the only parties permitted access to the court file are: (A) The Attorney General; (B) A prosecuting authority for the political subdivision on whose behalf the action is brought, unless the political subdivision is named as a defendant; and (C) A prosecuting authority for any other political subdivision interested in the matter whose identity has been provided to the court by the Attorney General. (4)   Parties not permitted access to the sealed court file  As long as records in a False Claims Act case are under seal, no defendant is permitted to have access to the court records or other information concerning the case. Defendants not permitted access include any political subdivision that has been named as a defendant in a False Claims Act action.  CALIFORNIA RULES OF COURT   2025",,,3329,
2.1008,"Excuses from jury service  (a) Duty of citizenship  Jury service, unless excused by law, is a responsibility of citizenship. The court and its staff must employ all necessary and appropriate means to ensure that citizens fulfill this important civic responsibility.  (Subd (a) amended effective January 1, 2007.)  (b) Principles  The following principles govern the granting of excuses from jury service by the jury commissioner on grounds of undue hardship under Code of Civil Procedure section 204: (1) No class or category of persons may be automatically excluded from jury duty except as provided by law. (2) A statutory exemption from jury service must be granted only when the eligible person claims it. (3) Deferring jury service is preferred to excusing a prospective juror for a temporary or marginal hardship. (4) Inconvenience to a prospective juror or an employer is not an adequate reason to be excused from jury duty, although it may be considered a ground for deferral.  (Subd (b) amended effective January 1, 2007.)  (c) Requests to be excused from jury service  All requests to be excused from jury service that are granted for undue hardship must be put in writing by the prospective juror, reduced to writing, or placed on the court's record. The prospective juror must support the request with facts specifying the hardship and a statement why the circumstances constituting the undue hardship cannot be avoided by deferring the prospective juror's service.  (Subd (c) amended effective January 1, 2007.)  (d) Reasons for excusing a juror because of undue hardship  An excuse on the ground of undue hardship may be granted for any of the following reasons: (1) The prospective juror has no reasonably available means of public or private transportation to the court. (2) The prospective juror must travel an excessive distance. Unless otherwise established by statute or local rule, an excessive distance is reasonable travel time that exceeds one-and-one-half hours from the prospective juror's home to the court. (3) The prospective juror will bear an extreme financial burden. In determining whether to excuse the prospective juror for this reason, consideration must be given to: (A) The sources of the prospective juror's household income; (B) The availability and extent of income reimbursement; (C) The expected length of service; and (D) Whether service can reasonably be expected to compromise the prospective juror's ability to support himself or herself or his or her dependents, or so disrupt the economic stability of any individual as to be against the interests of justice. (4) The prospective juror will bear an undue risk of material injury to or destruction of the prospective juror's property or property entrusted to the prospective juror, and it is not feasible to make alternative arrangements to alleviate the risk. In determining whether to excuse the prospective juror for this reason, consideration must be given to: (A) The nature of the property;  CALIFORNIA RULES OF COURT   2025",,,5358,
2.1009,"Permanent medical excuse from jury service  (a) Definitions  As used in this rule: (1) ""Applicant"" means a ""person with a disability"" or their authorized representative. (2) ""Authorized representative"" means a conservator, agent under a power of attorney (attorney-in-fact), or any other individual designated by the person with a disability. (3) ""Capable of performing jury service"" means a person can pay attention to evidence, testimony, and other court proceedings for up to six hours per day, with a lunch break and short breaks in the morning and afternoon, with or without disability-related accommodations, including auxiliary aids and services. (4) ""Health care provider"" means a doctor of medicine or osteopathy, podiatrist, dentist, chiropractor, clinical psychologist, optometrist, nurse practitioner, nurse-midwife, clinical social worker, therapist, physician's assistant, Christian Science Practitioner, or any other medical provider, facility, or organization that is authorized and performing within the scope of the practice of their profession in accordance with state or federal law and regulations. (5) ""Permanent medical excuse"" means a release from jury service granted by the jury commissioner to a person with a disability whose condition is unlikely to resolve and who, with or without disability-related accommodations, including auxiliary aids or services, is not capable of performing jury service. (6) ""Person with a disability"" means an individual covered by Civil Code section 51 et seq., the Americans With Disabilities Act of 1990 (42 U.S.C.  12101 et seq.), or other applicable state and federal laws. This definition includes a person who has a physical or mental medical condition that limits one or more of the major life activities, has a record of such a condition, or is regarded as having such a condition.  (b) Policy  (1) This rule is intended to allow a person with a disability whose condition is unlikely to resolve and who is unable for the foreseeable future to serve as a juror to seek a permanent medical excuse from jury service. This rule does not impose limitations on or invalidate the remedies, rights, and procedures accorded to persons with disabilities under state or federal law. (2) It is the policy of the courts of this state to ensure that persons with disabilities have equal and full access to the judicial system, including the opportunity to serve as jurors. No eligible jurors who can perform jury service, with or without disability-related accommodations, including auxiliary aids or services, may be excused from jury service due solely to their disability.  (c) Process for requesting permanent medical excuse  The process for requesting a permanent medical excuse from jury service is as follows: (1) An applicant must submit to the jury commissioner a written request for permanent medical excuse with a supporting letter, memo, or note from a treating health care provider. The supporting letter, memo, or note must be on the treating health care provider's letterhead, state that the person has a permanent disability that makes the person incapable of performing jury service, and be signed by the provider. (2) The applicant must submit the request and supporting letter, memo, or note to the jury commissioner on or before the date the person is required to appear for jury service. (3) In the case of an incomplete application, the jury commissioner may require the applicant to furnish additional information in support of the request for permanent medical excuse.  CALIFORNIA RULES OF COURT   2025",,,5560,
