rule_number,title,category,url,content_length,word_count
8.29,"Service on nonparty public officer or agency  (a) Proof of service  When a statute or this rule requires a party to serve any document on a nonparty public officer or agency, the party must file proof of such service with the document unless a statute permits service after the document is filed, in which case the proof of service must be filed immediately after the document is served on the public officer or agency.  (Subd (a) relettered effective January 1, 2007; adopted as subd (b).)  (b) Identification on cover  When a statute or this rule requires a party to serve any document on a nonparty public officer or agency, the cover of the document must contain a statement that identifies the statute or rule requiring service of the document on the public officer or agency in substantially the following form: ""Service on [insert name of the officer or agency] required by [insert citation to the statute or rule].""  (Subd (b) relettered effective January 1, 2007; adopted as subd (c).)  (c) Service on the Attorney General  In addition to any statutory requirements for service of briefs on public officers or agencies, a party must serve its brief or petition on the Attorney General if the brief or petition: (1) Questions the constitutionality of a state statute; or (2) Is filed on behalf of the State of California, a county, or an officer whom the Attorney General may lawfully represent in: (A) A criminal case; (B) A case in which the state or a state officer in his or her official capacity is a party; or (C) A case in which a county is a party, unless the county's interest conflicts with that of the state or a state officer in his or her official capacity.  (Subd (c) adopted effective January 1, 2007.) Rule 8.29 amended and renumbered effective January 1, 2007; adopted as rule 44.5 effective January 1, 2004; previously amended effective July 1, 2004.  Advisory Committee Comment  Rule 8.29 refers to statutes that require a party to serve documents on a nonparty public officer or agency. For a list of examples of such statutory requirements, please see the   Civil Case Information Statement   (form APP-004).  CALIFORNIA RULES OF COURT   2025",,,2164,
8.42,"Requirements for signatures of multiple parties on filed documents  When a document to be filed in paper form, such as a stipulation, requires the signatures of multiple parties, the original signature of at least one party must appear on the document filed in the reviewing court; the other signatures may be in the form of copies of the signed signature page of the document. Electronically filed documents must comply with the relevant provisions of rule 8.77.  Rule 8.42 amended effective January 1, 2016; adopted effective January 1, 2014.  CALIFORNIA RULES OF COURT   2025",,,584,
8.72,"Responsibilities of court and electronic filer  (a) Responsibilities of court  (1) The court will publish, in both electronic form and print form, the court's electronic filing requirements. (2) If the court is aware of a problem that impedes or precludes electronic filing, it must promptly take reasonable steps to provide notice of the problem.  (Subd (a) amended effective January 1, 2020; previously amended effective January 1, 2017.)  (b) Responsibilities of electronic filer  Each electronic filer must: (1) Take all reasonable steps to ensure that the filing does not contain computer code, including viruses, that might be harmful to the court's electronic filing system and to other users of that system; (2) Furnish one or more electronic service addresses, in the manner specified by the court, at which the electronic filer agrees to accept receipt and filing confirmations under rule 8.77 and, if applicable, at which the electronic filer agrees to receive electronic service; and (3) Immediately provide the court and all parties with any change to the electronic filer's electronic service address.  (Subd (b) amended effective January 1, 2021; previously adopted effective January 1, 2020) Rule 8.72 amended effective January 1, 2021; adopted as rule 8.74 effective July 1, 2010; previously amended and renumbered effective January 1, 2017; previously amended effective January 1, 2020.  Advisory Committee Comment Subdivision (b)(1 ). One example of a reasonable step an electronic filer may take is to use a commercial virus scanning program. Compliance with this subdivision requires more than an absence of intent to harm the court's electronic filing system or other users' systems.  CALIFORNIA RULES OF COURT   2025",,,1740,
8.75,"Requirements for signatures on documents  (a) Documents signed under penalty of perjury  When a document must be signed under penalty of perjury, the document is deemed to have been signed by the declarant if filed electronically, provided that either of the following conditions is satisfied: (1) The declarant has signed the document using an electronic signature (or a secure electronic signature if the declarant is not the electronic filer) and declares under penalty of perjury under the laws of the State of California that the information submitted is true and correct; or (2) The declarant, before filing, has physically signed a printed form of the document. By electronically filing the document, the electronic filer certifies that the original signed document is available for inspection and copying at the request of the court or any other party. In the event this second method of submitting documents electronically under penalty of perjury is used, the following conditions apply: (A) At any time after the electronic version of the document is filed, any other party may serve a demand for production of the original signed document. The demand must be served on all other parties but need not be filed with the court. (B) Within five days of service of the demand under (A), the party or other person on whom the demand is made must make the original signed document available for inspection and copying by all other parties. (C) At any time after the electronic version of the document is filed, the court may order the electronic filer to produce the original signed document for inspection and copying by the court. The order must specify the date, time, and place for the production and must be served on all parties.  (Subd (a) amended effective January 1, 2022; previously amended effective January 1, 2014.)  (b) Documents not signed under penalty of perjury  (1) If a document does not require a signature under penalty of perjury, the document is deemed signed by the electronic filer. (2) When a document to be filed electronically, such as a stipulation, requires the signatures of multiple persons, the document is deemed to have been signed by those persons if filed electronically, provided that either of the following procedures is satisfied: (A) The parties or other persons have signed the document using a secure electronic signature; or (B) The electronic filer has obtained all the signatures either in the form of an original signature on a printed form of the document or in the form of a copy of the signed signature page of the document. The electronic filer must maintain the original signed document and any copies of signed signature pages and must make them available for inspection and copying as provided in (a)(2)(B). The court and any party may demand production of the original signed document and any copies of the signed signature pages as provided in (a)(2)(A)-(C). By electronically filing the document, the electronic filer indicates that all persons whose signatures appear on it have signed the document and that the filer has possession of the signatures of all those persons in a form permitted by this rule.  (Subd (b) amended effective January 1, 2022.)  (c) Judicial signatures  If a document requires a signature by a court or a judicial officer, the document may be electronically signed in any manner permitted by law.  (Subd (c) amended and relettered effective January 1, 2022; adopted as Subd (e) effective July 1, 2010.)  CALIFORNIA RULES OF COURT   2025",,,3710,
3.1180,"Employment of attorney  A receiver must not employ an attorney without the approval of the court. The application for approval to employ an attorney must be in writing and must state: (1) The necessity for the employment; (2) The name of the attorney whom the receiver proposes to employ; and (3) That the attorney is not the attorney for, associated with, nor employed by an attorney for any party.  Rule 3.1180 amended and renumbered effective January 1, 2007; adopted as rule 1904 effective January 1, 2002.  CALIFORNIA RULES OF COURT   2025",,,552,
3.1385,"Duty to notify court and others of settlement of entire case  (a) Notice of settlement  (1)   Court and other persons to be notified  If an entire case is settled or otherwise disposed of, each plaintiff or other party seeking affirmative relief must immediately file written notice of the settlement or other disposition with the court and serve the notice on all parties and any arbitrator or other court-connected alternative dispute resolution (ADR) neutral involved in the case. Each plaintiff or other party seeking affirmative relief must also immediately give oral notice to all of the above if a hearing, conference, or trial is scheduled to take place within 10 days. (2)   Compensation for failure to provide notice  If the plaintiff or other party seeking affirmative relief does not notify an arbitrator or other court-connected ADR neutral involved in the case of a settlement at least 2 days before the scheduled hearing or session with that arbitrator or neutral, the court may order the party to compensate the arbitrator or other neutral for the scheduled hearing time. The amount of compensation ordered by the court must not exceed the maximum amount of compensation the arbitrator would be entitled to receive for service as an arbitrator under Code of Civil Procedure section 1141.18(b) or that the neutral would have been entitled to receive for service as a neutral at the scheduled hearing or session.  (Subd (a) amended effective January 1, 2007; previously amended effective January 1, 1989, July 1, 2001, July 1, 2002, January 1, 2004, and January 1, 2006.)  (b) Dismissal of case  Except as provided in (c) or (d), each plaintiff or other party seeking affirmative relief must serve and file a request for dismissal of the entire case within 45 days after the date of settlement of the case. If the plaintiff or other party required to serve and file the request for dismissal does not do so, the court must dismiss the entire case 45 days after it receives notice of settlement unless good cause is shown why the case should not be dismissed.  (Subd (b) amended effective January 1, 2009; adopted effective January 1, 1989; previously amended effective July 1, 2002, January 1, 2004, and January 1, 2006.)  (c) Conditional settlement  (1)   Notice  If the settlement agreement conditions dismissal of the entire case on the satisfactory completion of specified terms that are not to be performed within 45 days of the settlement, including payment in installment payments, the notice of conditional settlement served and filed by each plaintiff or other party seeking affirmative relief must specify the date by which the dismissal is to be filed. (2)   Dismissal  If the plaintiff or other party required to serve and file a request for dismissal within 45 days after the dismissal date specified in the notice does not do so, the court must dismiss the entire case unless good cause is shown why the case should not be dismissed. (3)   Hearings vacated  (A) Except as provided in (B), on the filing of the notice of conditional settlement, the court must vacate all hearings and other proceedings requiring the appearance of a party and may not set any hearing or other proceeding requiring the appearance of a party earlier than 45 days after the dismissal date specified in the notice, unless requested by a party.  CALIFORNIA RULES OF COURT   2025",,,6345,
2.572,"Ex parte application for an extension of time  A party in a False Claims Act case may apply under the ex parte rules in title 3 for an extension of time under Government Code section 12652.  Rule 2.572 amended and renumbered effective January 1, 2007; adopted as rule 243.7 effective July 1, 2002.  CALIFORNIA RULES OF COURT   2025",,,338,
8.76,"Payment of filing fees  (a) Use of credit cards and other methods  The court may permit the use of credit cards, debit cards, electronic fund transfers, or debit accounts for the payment of filing fees associated with electronic filing, as provided in Government Code section 6159 and other applicable law. The court may also authorize other methods of payment.  (b) Fee waivers  Eligible persons may seek a waiver of court fees and costs, as provided in Government Code section 68634.5 and rule 8.26.  Rule 8.76 renumbered effective January 1, 2017; adopted as rule 8.78 effective July 1, 2010; previously amended effective January 1, 2011.  Advisory Committee Comment Subdivision (b).   A fee charged by an electronic filing service provider under rule 8.73(b) is not a court fee that can be waived under Government Code section 68634.5 and rule 8.26.  CALIFORNIA RULES OF COURT   2025",,,887,
3.2207,"Electronic format  (a) Requirements  The electronic version of the administrative record lodged in the court in a proceeding brought under the California Environmental Quality Act must be: (1) In compliance with rule 3.2205; (2) Created in portable document format (PDF) or other format for which the software for creating and reading documents is in the public domain or generally available at a reasonable cost; (3) Divided into a series of electronic files and include electronic bookmarks that identify each part of the record and clearly state the volume and page numbers contained in each part of the record; (4) Contained on a CD-ROM, DVD, or other medium in a manner that cannot be altered; and (5) Capable of full text searching. The electronic version of the index required under rule 3.2205(b) may include hyperlinks to the indexed documents.  (Subd (a) amended effective July 1, 2014.)  (b) Documents not included  Unless otherwise required by law, any document that is part of the administrative record and for which it is not feasible to create an electronic version may be provided in paper format only. Not feasible means that it would be reduced in size or otherwise altered to such an extent that it would not be easily readable.  (Subd (b) amended effective July 1, 2014.) Rule 3.2207 renumbered and amended effective July 1, 2014; adopted as rule 3.1367 effective January 1, 2010.  CALIFORNIA RULES OF COURT   2025",,,1438,
8.57,"Motions before the record is filed  (a) Motion to dismiss appeal  A motion to dismiss an appeal before the record is filed in the reviewing court must be accompanied by a certificate of the superior court clerk, a declaration, or both, stating: (1) The nature of the action and the relief sought by the complaint and any cross-complaint or complaint in intervention; (2) The names, addresses, and telephone numbers of all attorneys of record-stating whom each represents-and unrepresented parties; (3) A description of the judgment or order appealed from, its entry date, and the service date of any written notice of its entry; (4) The factual basis of any extension of the time to appeal under rule 8.108; (5) The filing dates of all notices of appeal and the courts in which they were filed; (6) The filing date of any document necessary to procure the record on appeal; and (7) The status of the record preparation process, including any order extending time to prepare the record.  (Subd (a) amended effective January 1, 2007.)  (b) Other motions  Any other motion filed before the record is filed in the reviewing court must be accompanied by a declaration or other evidence necessary to advise the court of the facts relevant to the relief requested.  Rule 8.57 amended and renumbered effective January 1, 2007; repealed and adopted as rule 42 effective January 1, 2005.  CALIFORNIA RULES OF COURT   2025",,,1413,
8.85,"Fees for copies of electronic records  The court may impose fees for the costs of providing copies of its electronic records, under Government Code section 68928.  Rule 8.85 adopted effective January 1, 2016.  CALIFORNIA RULES OF COURT   2025",,,248,
2.150,"Authorization for computer-generated or typewritten forms for proof of service of summons and complaint  (a) Computer-generated or typewritten forms; conditions  Notwithstanding the adoption of mandatory form   Proof of Service of Summons   (form POS-010), a form for proof of service of a summons and complaint prepared entirely by word processor, typewriter, or similar process may be used for proof of service in any applicable action or proceeding if the following conditions are met: (1) The form complies with the rules in chapter 1 of this division except as otherwise provided in this rule, but numbered lines are not required. (2) The left, right, and bottom margins of the proof of service must be at least 1/2 inch. The top margin must be at least 3/4 of an inch. The typeface must be Times New Roman, Courier, Arial, or an equivalent typeface not smaller than 9 points. Text must be single-spaced and a blank line must precede each main numbered item. (3) The title and all the text of form POS-010 that is not accompanied by a check box must be copied word for word except for any instructions, which need not be copied. In addition, the optional text describing the particular method of service used must be copied word for word, except that the check boxes must not be copied. Any optional text not describing such service need not be included. (4) The Judicial Council number of the   Proof of Service of Summons   must be typed as follows either in the left margin of the first page opposite the last line of text or at the bottom of each page: ""Judicial Council form POS-010."" (5) The text of form POS-010 must be copied in the same order as it appears on form POS-010 using the same item numbers. A declaration of diligence may be attached to the proof of service or inserted as item 5b(5). (6) Areas marked ""For Court Use"" must be copied in the same general locations and occupy approximately the same amount of space as on form POS-010. (7) The telephone number of the attorney or party must appear flush with the left margin and below the attorney's or party's address. (8) The name of the court must be flush with the left margin. The address of the court is not required. (9) Material that would have been entered onto form POS-010 must be entered with each line indented 3 inches from the left margin.  (Subd (a) amended effective January 1, 2016; previously amended effective July 1, 1985, January 1, 1986, January 1, 1987, July 1, 1999, January 1, 2004, July 1, 2004, and January 1, 2007.)  (b) Compliance with rule  The act of filing a computer-generated or typewritten form under this rule constitutes a certification by the party or attorney filing the form that it complies with this rule and is a true and correct copy of the form to the extent required by this rule.  (Subd (b) amended effective January 1, 2004; previously amended effective July 1, 1985, January 1, 1987, January 1, 1988, and July 1, 1999; relettered effective January 1, 1986.) Rule 2.150 amended effective January 1, 2016; adopted as rule 982.9; previously amended effective January 1, 1989, July 1, 1999, January 1, 2004, and July 1, 2004; previously amended and renumbered as rule 2.150 effective January 1, 2007.  Advisory Committee Comment CALIFORNIA RULES OF COURT   2025",,,3504,
3.1100,"Application  The rules in this division apply to proceedings in civil law and motion, as defined in rule 3.1103, and to discovery proceedings in family law and probate.  Rule 3.1100 amended and renumbered effective January 1, 2007; adopted as rule 301 effective January 1, 1984; previously amended effective July 1, 1984, July 1, 1997, and January 1, 2002.  CALIFORNIA RULES OF COURT   2025",,,398,
3.1103,"Definitions and construction  (a) Law and motion defined  ""Law and motion"" includes any proceedings: (1) On application before trial for an order, except for causes arising under the Welfare and Institutions Code, the Probate Code, the Family Code, or Code of Civil Procedure sections 527.6, 527.7, 527.8, and 527.85; or (2) On application for an order regarding the enforcement of judgment, attachment of property, appointment of a receiver, obtaining or setting aside a judgment by default, writs of review, mandate and prohibition, a petition to compel arbitration, and enforcement of an award by arbitration.  (Subd (a) amended effective January 1, 2011; previously amended effective July 1, 1997.)  (b) Application of rules on extending or shortening time  Rules 1.10(c) and 2.20 on extending or shortening time apply to proceedings under this division.  (Subd (b) amended effective January 1, 2007.)  (c) Application to demurrers  Unless the context or subject matter otherwise requires, the rules in this division apply to demurrers.  (Subd (c) amended effective January 1, 2007.) Rule 3.1103 amended effective January 1, 2011; adopted as rule 303 effective January 1, 1984; previously amended effective July 1, 1984; previously amended and renumbered effective January 1, 2007.  CALIFORNIA RULES OF COURT   2025",,,1320,
3.1130,"Bonds and undertakings  (a) Prerequisites to acceptance of corporate sureties  A corporation must not be accepted or approved as surety on a bond or undertaking unless the following conditions are met: (1) The Insurance Commissioner has certified the corporation as being admitted to do business in the state as a surety insurer; (2) There is filed in the office of the clerk a copy, duly certified by the proper authority, of the transcript or record of appointment entitling or authorizing the person or persons purporting to execute the bond or undertaking for and in behalf of the corporation to act in the premises; and (3) The bond or undertaking has been executed under penalty of perjury as provided in Code of Civil Procedure section 995.630, or the fact of execution of the bond or undertaking by the officer or agent of the corporation purporting to become surety has been duly acknowledged before an officer of this state authorized to take and certify acknowledgements.  (Subd (a) amended effective January 1, 2007.)  (b) Certain persons not eligible to act as sureties  An officer of the court or member of the State Bar may not act as a surety.  (Subd (b) amended effective January 1, 2007.)  (c) Withdrawal of bonds and undertakings  An original bond or undertaking may be withdrawn from the files and delivered to the party by whom it was filed on order of the court only if all parties interested in the obligation so stipulate, or upon a showing that the purpose for which it was filed has been abandoned without any liability having been incurred.  Rule 3.1130 amended and renumbered effective January 1, 2007; adopted as rule 381 effective January 1, 1984.  CALIFORNIA RULES OF COURT   2025",,,1712,
3.1140,"Lodging of record in administrative mandate cases  The party intending to use a part of the administrative record in a case brought under Code of Civil Procedure section 1094.5 must lodge that part of the record at least five days before the hearing.  Rule 3.1140 amended and renumbered effective January 1, 2007; adopted as rule 347 effective January 1, 1984.  CALIFORNIA RULES OF COURT   2025",,,402,
3.1142,"Stay of driving license suspension  A request for a stay of a suspension of a driving license must be accompanied by a copy of the petitioner's driving record from the Department of Motor Vehicles.  Rule 3.1142 amended and renumbered effective January 1, 2007; adopted as rule 355 effective January 1, 1984.  CALIFORNIA RULES OF COURT   2025",,,349,
