rule_number,title,category,url,content_length,word_count
5.335,"Procedures for hearings on interstate income withholding orders  (a) Purpose  This rule provides a procedure for a hearing under Family Code section 5700.506 in response to an income withholding order.  (Subd (a) amended effective September 1, 2021; previously amended effective January 1, 2003.)  (b) Filing of request for hearing  A support obligor may contest the validity or enforcement of an income withholding order by filing a completed request for hearing .   A copy of the income withholding order must be attached.  (c) Filing fee  The court must not require a filing fee to file the request for hearing under this rule.  (Subd (c) amended effective January 1, 2003.)  (d) Creation of court file  Upon receipt of the completed request for hearing and a copy of the income withholding order, the clerk must assign a case number and schedule a court date. The court date must be no earlier than 30 days from the date of filing and no later than 45 days from the date of filing.  (Subd (d) amended effective January 1, 2003.)  (e) Notice of hearing  The support obligor must provide the clerk with envelopes addressed to the obligor, the support enforcement agency that sent the income withholding order, and the obligor's employer. The support obligor must also provide an envelope addressed to the person or agency designated to receive the support payments if that person or agency is different than the support enforcement agency that sent the income withholding order. The support obligor must provide sufficient postage to mail each envelope provided. Upon scheduling the hearing, the clerk must mail a copy of the request for hearing in each envelope provided by the support obligor.  (Subd (e) amended effective January 1, 2007; previously amended effective January 1, 2003.)  (f) Use of court file in subsequent proceedings  Any subsequent proceedings filed in the same court that involve the same parties and are filed under the Uniform Interstate Family Support Act (UIFSA) must use the file number created under this rule.  (Subd (f) amended effective January 1, 2007; previously amended effective January 1, 2003.)  (g) Definitions  As used in this rule: (1) An ""income withholding order"" is the   Order/Notice to Withhold Income for Child Support   (form FL-195) issued by a child support enforcement agency in another state; and (2) A ""request for hearing"" is the   Request for Hearing Regarding Wage and Earnings Assignment (Family Law-Governmental- UIFSA)   (form FL-450).  (Subd (g) amended effective January 1, 2007; previously amended effective January 1, 2003.) Rule 5.335 amended effective September 1, 2021; adopted as rule 1280.7 effective July 1, 1999; previously amended and renumbered effective January 1, 2003; previously amended effective January 1, 2007.  CALIFORNIA RULES OF COURT   2025",,,2808,
10.613,"Local court rules-adopting, filing, distributing, and maintaining  (a) Definitions  As used in this rule: (1) ""Court"" means a trial court; and (2) ""Local rule"" means every rule, regulation, order, policy, form, or standard of general application adopted by a court to govern practice or procedure in that court or by a judge of the court to govern practice or procedure in that judge's courtroom.  (Subd (a) amended and relettered effective July 1, 1999; adopted as subd (b) and repealed effective July 1, 1991.)  (b) Local inspection and copying of rules  Each court must make its local rules available for inspection and copying in every location of the court that generally accepts filing of papers. The court may impose a reasonable charge for copying the rules and may impose a reasonable page limit on copying. The rules must be accompanied by a notice indicating where a full set of the rules may be purchased or otherwise obtained.  (Subd (b) amended effective January 1, 2003; adopted as subd (c); previously relettered effective July 1, 1999.)  (c) Publication of rules  (1) Each court executive officer must be the official publisher of the court's local rules unless the court, by a majority vote of the judges, appoints another public agency or a private company. (2) The official publisher must have the local rules reproduced and make copies available for distribution to attorneys and litigants. (3) The court must adopt rules in sufficient time to permit reproduction of the rules by the official publisher before the effective date of the changes. (4) The official publisher may charge a reasonable fee. (5) Within 30 days of selecting an official publisher or changing an official publisher, each court must notify the Judicial Council of the name, address, and telephone number of the official publisher. Within 30 days of a change in the cost of the rules, each court must notify the Judicial Council of the charge for the local rules. This information will be published annually by the Judicial Council.  (Subd (c) amended effective January 1, 2003; adopted as subd (d); amended and relettered effective July 1, 1999.)  (d) Filing rules with the Judicial Council  (1) Forty-five days before the effective date of January 1 or July 1, each court must file with the Judicial Council an electronic copy of rules and amendments to rules adopted by the court in a format authorized by the Judicial Council. (2) The filing must be accompanied by a certificate from the presiding judge or court executive officer stating that: (A) The court has complied with the applicable provisions of this rule; (B) The court does or does not post local rules on the court's Web site; and (C) The court does or does not provide assistance to members of the public in accessing the Internet or the court has delegated to and obtained the written consent of the county law librarian to provide public assistance under (e). (3) Rules that do not comply with this rule will not be accepted for filing by the Judicial Council.  (Subd (d) amended effective January 1, 2009; adopted as subd (e); amended and relettered effective July 1, 1999; previously amended effective January 1, 2003, and January 1, 2007.)  CALIFORNIA RULES OF COURT   2025",,,9535,
10.953,"Procedures for disposition of cases before the preliminary hearing  (a) Disposition before preliminary hearing  Superior courts having more than three judges must, in cooperation with the district attorney and defense bar, adopt procedures to facilitate dispositions before the preliminary hearing and at all other stages of the proceedings. The procedures may include: (1) Early, voluntary, informal discovery, consistent with part 2, title 6, chapter 10 of the Penal Code (commencing with section 1054); and (2) The use of superior court judges as magistrates to conduct readiness conferences before the preliminary hearing and to assist, where not inconsistent with law, in the early disposition of cases.  (Subd (a) amended effective January 1, 2007; previously amended effective June 6, 1990, and January 1, 1991.)  (b) Case to be disposed of under rule 4.114  Pleas of guilty or no contest resulting from proceedings under (a) must be disposed of as provided in rule 4.114.  (Subd (b) amended effective January 1, 2007; previously amended effective July 1, 2001.) Rule 10.953 amended and renumbered effective January 1, 2007; adopted as rule 227.10 effective January 1, 1985; previously amended effective June 6, 1990, January 1, 1991, and July 1, 2001. Chapter 14 adopted effective July 1, 2008.  CALIFORNIA RULES OF COURT   2025",,,1340,
1.45,"Judicial Council pleading forms  (a) Pleading forms  The forms listed under the ""Pleading"" heading on the list of Judicial Council forms in Appendix A to the California Rules of Court are approved by the Judicial Council.  (Subd (a) amended effective July 1, 2008; previously amended effective July 1, 1999, January 1, 2005, and January 1, 2007.)  (b) Cause of action forms  Any approved cause of action form may be attached to any approved form of complaint or cross-complaint.  (Subd (b) adopted effective January 1, 1982.)  (c) Other causes of action  A cause of action for which no form has been approved may be prepared in the format prescribed by the rules in chapter 1 of division 2 of title 2 and attached to any approved form of complaint or cross-complaint. Each paragraph within a cause of action must be numbered consecutively beginning with one. Each paragraph number must be preceded with one or more identifying letters derived from the title of the cause of action.  (Subd (c) amended effective January 1, 2007; adopted effective January 1, 1982; previously amended effective January 1, 2003.) Rule 1.45 amended effective July 1, 2008; adopted as rule 982.1 effective January 1, 1982; previously amended effective July 1, 1995, July 1, 1996, January 1, 1997, July 1, 1999, and January 1, 2005; previously amended and renumbered as rule 201.2 effective January 1, 2003; previously amended and renumbered effective January 1, 2007.  CALIFORNIA RULES OF COURT   2025",,,1478,
4.103,"Notice to appear forms  (a) Traffic offenses  A printed or electronic notice to appear that is issued for any violation of the Vehicle Code other than a felony or for a violation of an ordinance of a city or county relating to traffic offenses must be prepared and filed with the court on  Automated Traffic Enforcement System Notice to Appear   (form TR-115),   Traffic/Nontraffic Notice to Appear   (form TR-130),  Electronic Traffic/Nontraffic Notice to Appear   (4-inch format) (form TR-135), or   Electronic Traffic/Nontraffic Notice to Appear   (3- inch format) (form TR-145), and must comply with the requirements in the current version of the Judicial Council's instructions,   Notice to Appear and Related Forms   (form TR-INST).  (b) Nontraffic offenses  A notice to appear issued for a nontraffic infraction or misdemeanor offense that is prepared on   Nontraffic Notice to Appear  (form TR-120),   Traffic/Nontraffic Notice to Appear   (form TR-130),   Electronic Traffic/Nontraffic Notice to Appear   (4-inch format) (form TR-135), or   Electronic Traffic/Nontraffic Notice to Appear   (3-inch format) (form TR-145), and that complies with the requirements in the current version of the Judicial Council's instructions,   Notice to Appear and Related Forms   (form TR-INST), may be filed with the court and serve as a complaint as provided in Penal Code section 853.9 or 959.1.  (c) Corrections  Corrections to citations previously issued on   Continuation of Notice to Appear   (form TR-106),   Continuation of Citation   (form TR-108),   Automated Traffic Enforcement System Notice to Appear   (form TR-115),   Nontraffic Notice to Appear   (form TR-120),  Traffic/Nontraffic Notice to Appear   (form TR-130),   Electronic Traffic/Nontraffic Notice to Appear   (4-inch format) (form TR-135), or   Electronic Traffic/Nontraffic Notice to Appear   (3-inch format) (form TR-145) must be made on a   Notice of Correction and Proof of Service   (form TR-100).  (d) Electronic citation forms  A law enforcement agency that uses an electronic citation device to issue notice to appear citations on the Judicial Council's  Electronic Traffic/Nontraffic Notice to Appear   (4-inch format) (form TR-135) or   Electronic Traffic/Nontraffic Notice to Appear   (3- inch format) (form TR-145) must submit to the Judicial Council an exact printed copy of the agency's current citation form that complies with the requirements in the most recent version of the Judicial Council's instructions,   Notice to Appear and Related Forms   (form TR-INST).  Rule 4.103 amended effective June 26, 2015; adopted effective January 1, 2004; previously amended effective January 1, 2007.  CALIFORNIA RULES OF COURT   2025",,,2628,
4.151,"Motion for change of venue  (a) Motion procedure  A motion for change of venue in a criminal case under Penal Code section 1033 must be supported by a declaration stating the facts supporting the application. Except for good cause shown, the motion must be filed at least 10 days before the date set for trial, with a copy served on the adverse party at least 10 days before the hearing. At the hearing counterdeclarations may be filed.  (Subd (a) amended effective January 1, 2007; adopted effective January 1, 2006; formerly part of an unlettered subd.)  (b) Policy considerations in ruling on motion  Before ordering a change of venue in a criminal case, the transferring court should consider impaneling a jury that would give the defendant a fair and impartial trial.  (Subd (b) adopted effective January 1, 2006.) Rule 4.151 amended effective January 1, 2007; adopted as rule 841 effective March 4, 1972; previously amended and renumbered effective January 1, 2001; previously amended effective January 1, 2006.  Advisory Committee Comment  Rule 4.151(b) is not intended to imply that the court should attempt to impanel a jury in every case before granting a change of venue.  CALIFORNIA RULES OF COURT   2025",,,1217,
5.330,"Procedures for child support case registry form  (a) Purpose  This rule provides guidance to court clerks in processing the   Child Support Case Registry Form   (form FL-191).  (Subd (a) amended effective January 1, 2007; previously amended effective January 1, 2003.)  (b) Application  This rule applies to any action or proceeding in which there is an order for child support or family support except for cases in which the local child support agency provides support enforcement services under Family Code section 17400. This rule does not apply to cases in which the local child support agency provides support enforcement services under Family Code section 17400.  (Subd (b) amended effective January 1, 2003.)  (c) Requirement that form be filed  The court must require that a   Child Support Case Registry Form   (form FL-191), completed by one of the parties, be filed each time an initial court order for child support or family support or a modification of a court order for child support or family support is filed with the court. A party attempting to file an initial judgment or order for child support or family support or a modification of an order for child or family support without a completed   Child Support Case Registry Form   (form FL-191) must be given a blank form to complete. The form must be accepted if legibly handwritten in ink or typed. No filing fees may be charged for filing the form.  (Subd (c) amended effective January 1, 2007; previously amended effective January 1, 2003.)  (d) Distribution of the form  Copies of the   Child Support Case Registry Form   (form FL-191) must be made available by the clerk's office and the family law facilitator's office to the parties without cost. A blank copy of the   Child Support Case Registry Form   (form FL-191) must be sent with the notice of entry of judgment to the party who did not submit the judgment or order.  (Subd (d) amended effective January 1, 2003.)  (e) Items on form that must be completed  A form must be considered complete if items 1b, 1c, 2, 5, and 6 are completed. Either item 3 or item 4 must also be completed as appropriate. If the form is submitted with the judgment or order for court approval, the clerk must complete item 1a once the judgment or order has been signed by the judicial officer and filed.  (Subd (e) amended effective January 1, 2003.)  (f) Clerk handling of form  The completed   Child Support Case Registry Form   (form FL-191) must not be stored in the court's file. It should be date and time stamped when received and stored in an area to which the public does not have access. At least once per month all forms received must be mailed to the California Department of Social Services.  (Subd (f) amended effective January 1, 2003.)  (g) Storage of confidential information  Provided that all information is kept confidential, the court may keep either a copy of the form or the information provided on the form in an electronic format.  CALIFORNIA RULES OF COURT   2025",,,3117,
5.409,"Default and uncontested judgment hearings on judgments submitted on the basis of declarations under Family Code section 2336  The decision to hold a hearing in a case in which a judgment has been submitted on the basis of a declaration under Family Code section 2336 should be made on a case-by-case basis at the discretion of the court or request of a party. Courts must allow judgments in default and uncontested cases to be submitted by declaration pursuant to section 2336 and must not require that a hearing be conducted in all such cases.  Rule 5.409 renumbered effective January 1, 2013; adopted as rule 5.148 effective July 1, 2012.  CALIFORNIA RULES OF COURT   2025",,,681,
10.1016,"Notice of failure to perform judicial duties  (a) Notice  (1) The Chief Justice or presiding justice must notify the Commission on Judicial Performance of a reviewing court justice's: (A) Substantial failure to perform judicial duties, including any habitual neglect of duty; or (B) Disability-caused absences totaling more than 90 court days in a 12-month period, excluding absences for authorized vacations and for attending schools, conferences, and judicial workshops. (2) If the affected justice is a presiding justice, the administrative presiding justice must give the notice.  (Subd (a) amended effective January 1, 2007.)  (b) Copy to justice  The Chief Justice, administrative presiding justice, or presiding justice must give the affected justice a copy of any notice under (a).  Rule 10.1016 amended and renumbered effective January 1, 2007; repealed and adopted as rule 78 effective January 1, 2005.  CALIFORNIA RULES OF COURT   2025",,,951,
3.503,"Requests for extensions of time or to shorten time  (a) Assigned judge may grant request  The assigned judge, on terms that are just, may shorten or extend the time within which any act is permitted or required to be done by a party. Unless otherwise ordered, any motion or application for an extension of time to perform an act required by these rules must be served and submitted in accordance with rule 3.501(17).  (Subd (a) amended effective January 1, 2007; adopted as part of unlettered subd effective January 1, 1974; previously amended and lettered effective January 1, 2005.)  (b) Stipulation requires consent of assigned judge  A stipulation for an extension of time for the filing and service of documents required by the rules in this chapter requires approval of the assigned judge.  (Subd (b) amended and lettered effective January 1, 2005; adopted as part of unlettered subd effective January 1, 1974.)  (c) Extension does not extend time for bringing action to trial  Nothing in this rule extends the time within which a party must bring an action to trial under Code of Civil Procedure section 583.310.  (Subd (c) adopted effective January 1, 2005.) Rule 3.503 amended and renumbered effective January 1, 2007; adopted as rule 1503 effective January 1, 1974; previously amended effective January 1, 2005.  CALIFORNIA RULES OF COURT   2025",,,1355,
3.1550,"Time limits  Including jury voir dire, each side will be allowed five hours to present its case, including opening statements and closing arguments, unless the court, upon a finding of good cause, allows additional time. The amount of time allotted for each side includes the time that the side spends on cross-examination. The parties are encouraged to streamline the trial process by limiting the number of live witnesses. The goal is to complete an expedited jury trial within two trial days.  Rule 3.1550 amended effective July 1, 2016; adopted effective January 1, 2011.  CALIFORNIA RULES OF COURT   2025",,,617,
5.643,"Mental health or condition of child; court procedures  (a) Doubt concerning the mental health of a child ( 357, 705, 6550, 6551)  Whenever the court believes that the child who is the subject of a petition filed under section 300, 601, or 602 is mentally disabled or may be mentally ill, the court may stay the proceedings and order the child taken to a facility designated by the court and approved by the State Department of Mental Health as a facility for 72-hour treatment and evaluation. The professional in charge of the facility must submit a written evaluation of the child to the court.  (Subd (a) amended effective January 1, 2007.)  (b) Findings regarding a mental disorder ( 6551)  Article 1 of chapter 2 of part 1 of division 5 (commencing with section 5150) applies. (1) If the professional reports that the child is not in need of intensive treatment, the child must be returned to the juvenile court on or before the expiration of the 72-hour period, and the court must proceed with the case under section 300, 601, or 602. (2) If the professional in charge of the facility finds that the child is in need of intensive treatment for a mental disorder, the child may be certified for not more than 14 days of involuntary intensive treatment according to the conditions of sections 5250(c) and 5260(b). The stay of the juvenile court proceedings must remain in effect during this time. (A) During or at the end of the 14 days of involuntary intensive treatment, a certification may be sought for additional treatment under sections commencing with 5270.10 or for the initiation of proceedings to have a conservator appointed for the child under sections commencing with 5350. The juvenile court may retain jurisdiction over the child during proceedings under sections 5270.10 et seq. and 5350 et seq. (B) For a child subject to a petition under section 602, if the child is found to be gravely disabled under sections 5300 et seq., a conservator is appointed under those sections, and the professional in charge of the child's treatment or of the treatment facility determines that proceedings under section 602 would be detrimental to the child, the juvenile court must suspend jurisdiction while the conservatorship remains in effect. The suspension of jurisdiction may end when the conservatorship is terminated, and the original 602 matter may be calendared for further proceedings.  (Subd (b) amended effective January 1, 2007.)  (c) Findings regarding developmental disability ( 6551)  Article 1 of chapter 2 of part 1 of division 5 (commencing with section 5150) applies. (1) If the professional finds that the child has a developmental disability and recommends commitment to a state hospital, the court may direct the filing in the appropriate court of a petition for commitment of a child who has a developmental disability to the State Department of Developmental Services for placement in a state hospital. (2) If the professional finds that the child does not have a developmental disability, the child must be returned to the juvenile court on or before the expiration of the 72-hour period, and the court must proceed with the case under section 300, 601, or 602. (3) The jurisdiction of the juvenile court must be suspended while the child is subject to the jurisdiction of the appropriate court under a petition for commitment of a person who has a developmental disability, or under remand for 90 days for intensive treatment or commitment ordered by that court.  (Subd (c) amended effective January 1, 2020; previously amended effective January 1, 2007, and January 1, 2009.)  (d) Doubt as to capacity to cooperate with counsel ( 601, 602; Pen. Code,  1367)  (1) If the court finds that there is substantial evidence that a child who is the subject of a petition filed under section 601 or 602 lacks sufficient present ability to consult with counsel and assist in preparing his or her defense with a  CALIFORNIA RULES OF COURT   2025",,,7455,
10.181,"Court facilities policies, procedures, and standards  (a) Responsibilities of Judicial Council staff  Judicial Council staff, after consultation with the Court Facilities Transitional Task Force, must prepare and present to the Judicial Council recommendations for policies, procedures, and standards concerning the operation, maintenance, alteration, remodeling, renovation, expansion, acquisition, space programming, design, and construction of appellate and trial court facilities under Government Code sections 69204(c) and 70391(e).  (Subd (a) amended effective January 1, 2016; adopted as part of unlettered subd; previously amended and lettered as subd (a) effective January 1, 2007.)  (b) Consultations with the affected court and with local governmental and community interests  The policies, procedures, and standards must ensure that decisions are made in consultation with the affected court, when appropriate, and that decisions concerning acquisition, design, and construction of court facilities are made in consultation with local governmental and community interests, when appropriate.  (Subd (b) lettered and amended effective January 1, 2007; adopted as part of unlettered subd.) Rule 10.181 amended effective January 1, 2016; adopted as rule 6.180 effective June 23, 2004; previously amended effective April 21, 2006; previously amended and renumbered as rule 10.181 effective January 1, 2007.  CALIFORNIA RULES OF COURT   2025",,,1451,
